Institution,Boston Conservatory,Boston Conservatory,Boston University,Brandeis University,Bridgewater State,Bridgewater State,Bridgewater State,Bryant University,Florida State University,Florida State University,Florida State University,Florida State University,Franklin Pierce University,Kansas State University,Kansas State University,Kansas Wesleyan University,Longy School of Music,Longy School of Music,NEC,NEC,NEC,NEC,NEC,NEC,NEC,NEC,NEC,NEC,NEC,NEC,NEC,NEC,NEC,NEC,NEC,NEC,NEC,NEC,Northeastern University,Northeastern University,Northeastern University,Pacific Lutheran University,Pittsburg State University,Pittsburg State University,Rowan University,Royal Irish Academy,Royal Irish Academy,Royal Irish Academy,Royal Irish Academy,Royal Irish Academy,Royal Irish Academy,Royal Irish Academy,Royal Irish Academy,Royal Irish Academy,Sacramento City College,San Francisco Conservatory,Shenandoah University,Stonehill College,Suffolk County Community College,Suffolk County Community College,Suffolk County Community College,Suffolk County Community College,Suffolk County Community College,SUNY Purchase,Syracuse University,Syracuse University,Syracuse University,Syracuse University,Taylor University,Taylor University,Taylor University,Taylor University,Taylor University,Temple College,Temple University,Temple University,Temple University,Ulster County Community College,Ulster County Community College,Ulster County Community College,Ulster County Community College,Ulster County Community College,UMass Amherst,UMass Amherst,UMass Amherst,UMass Amherst,UMass Amherst,UMass Amherst,UMass Amherst,UMass Amherst,UMass Amherst,UMass Amherst,UMass Amherst,UMass Amherst,UMass Amherst,UMass Amherst,UMass Amherst,UMass Amherst,UMass Amherst,UMass Amherst,UMass Amherst,UMass Amherst,UMass Amherst,UMass Amherst,UMass Dartmouth,UMass Lowell,Union Adventist University,University of Colorado Denver,University of Colorado Denver,University of Colorado Denver,University of Colorado Denver,University of Colorado Denver,University of Colorado Denver,University of Colorado Denver,University of Delaware,University of Delaware,University of Denver,University of Florida,University of Georgia,University of Georgia,University of Hartford,University of Mary Hardin-Baylor,University of the Incarnate Word,University of the Incarnate Word,University of the Incarnate Word,University of the Incarnate Word,University of the Incarnate Word,Westfield State University,Westfield State University,Westfield State University,Westfield State University,Westfield State University
Scholarship Name,Merit-Based Scholarships,Presidential Scholarships,Music Scholarships,Leonard Bernstein Fellowship,Barbara LaFrance Scholarship,Elsie P. Johnson Music Fund,Frieda Rand Music Endowment Fund for Performance Studies,Pep Band Scholarships,Vires and Mores Scholarships,Presidential Scholarship,Benacquisto Scholarship,Music Talent Scholarships,Athletic Band Scholarships,General Music Scholarship,Ensemble Scholarships,Bill McMosley Music Scholarship Competition,Teaching Assistantships,Scholarships,Presidential Distinction Scholarship,Dean's Scholarship,From the Top Scholarships,Dorothy Hinton Congleton Memorial Presidential Scholarship,Edward Hyde Cox Presidential Scholarship,Francis W. Hatch Presidential Scholarship,Helena Foundation Presidential Scholarship,Carol T. and Robert P. Henderson Presidential Scholarship,Emma V. Lambrose Presidential Scholarship,Laurence Lesser Presidential Scholarship,John Moriarty Presidential Scholarship,Charlotte F. Rabb Presidential Scholarship,Edward P. and Margaret Richardson Presidential Scholarship,Wendy Shattuck '75 Presidential Scholarship in Vocal Studies,Abraham Skernick Memorial Presidential Scholarship,Helen Haxton Stare Presidential Scholarship in Voice,Irene M. Stare Presidential Scholarship in Violin,Joan and Henry Wheeler Presidential Scholarship,Donna Hieken Presidential Scholarship in Flute,Masuko Ushioda Dean's Scholarship,Thomas F Symmons Music Scholarship,Joshua Jacobson Choral Music Scholarship,Ensemble Scholarships,Music Artistic Achievement Award,Music Scholarships,Band Participation Awards,Music Scholarships,1848 Admin Assistance Scholarship,1848 Teaching Assistant/Accompanist Scholarship,Distinguished Student Scholarship,Distinguished Student Scholarship,Distinguished Student Scholarship,International First-Time Entrance Scholarship,International First-Time Entrance Scholarship,International First-Time Entrance Scholarship,John Pollard Bursary,Music Scholarships,Scholarships,Conservatory Scholarship,Music Scholarships,Rienecker Scholarship,Kelly Recital Scholarship,Goldberg Memorial Scholarship,Sodders Scholarship,Satzman Scholarship,Talent Scholarships,Setnor Awards,Orchestral String Awards,Director's Awards,Distinguished Music Performance Award,Major Scholarship Awards,Minor Scholarship Awards,Endowed Scholarship Awards,Departmental Participation Awards,Bachelor of Fine Arts in Musical Theatre Scholarship,Music Performance Scholarships,Diamond Bands Scholarships,Music Assistantships,Performance Grants,Lohre Memorial Scholarship,O'Brien Scholarship,Zimmerman Scholarship,Herrington Scholarship,Aaron Memorial Scholarship,HFA Scholarships,UMass Band Alumni Scholarship,Ann Elder Bestor Memorial Music Scholarship,Philip Bezanson Scholarship,David W. Briggs Scholarship in Memory of Jean S. Briggs,Susan Cunningham Campbell Scholarship,Walter Chesnut Music Scholarship,Russell E. & Janet R. Falvey Scholarship,Friends of Music Senior Award,Thom Hannum Marching Band Percussion Scholarship,Richard Jones Scholarship,Klock Saxophone and the Campbell Klock Horn Studio Awards,Howard M. Lebow Memorial Scholarship,Eugenie M. May Award for Piano Performance,Jeffrey Morgan Memorial Scholarship,Julian Olevsky Memorial Scholarship in Violin,Ornest Award,Theodore Presser Award,Power & Class Scholarship,Nadine E. Shank Piano Scholarship,Nadine E. Shank Double Major Scholarship,C. Lynn Vendien Minuteman Marching Band Scholarship,Bobby Greene Music Scholarship,Music Scholarships,Music Ambassador Scholarships,Melnick Scholarship,CAM Scholarship,LYNX Camp Alumni Scholarship,Tashiro Scholarship,Barney Scholarship,MIX A Capella Scholarship,Bogard Scholarship,Music Scholarships,Fightin' Blue Hen Marching Band Scholarship,Lamont School of Music Scholarships,Music Scholarships,Marching Band Scholarships,General Music Scholarships,Performing Arts Scholarships,Music Scholarships,Band Scholarship,Annually Renewable Music Scholarships,One-Year Music Scholarships,Ensemble Scholarships,Endowed Scholarships,Friends of Music Scholarship,Dower Scholarship,Rogers Music Merit Scholarship,Manzer Music Scholarship,Musical Theater Guild Scholarship
Deadline,N/A,N/A,N/A,N/A,N/A,N/A,N/A,N/A,N/A,N/A,N/A,N/A,N/A,N/A,N/A,N/A,N/A,N/A,N/A,N/A,N/A,N/A,N/A,N/A,N/A,N/A,N/A,N/A,N/A,N/A,N/A,N/A,N/A,N/A,N/A,N/A,N/A,N/A,N/A,N/A,N/A,N/A,N/A,N/A,N/A,N/A,N/A,N/A,N/A,N/A,N/A,N/A,N/A,N/A,N/A,N/A,N/A,N/A,N/A,N/A,N/A,N/A,N/A,N/A,N/A,N/A,N/A,N/A,N/A,N/A,N/A,N/A,N/A,N/A,N/A,N/A,N/A,N/A,N/A,N/A,N/A,N/A,N/A,N/A,N/A,N/A,N/A,N/A,N/A,N/A,N/A,N/A,N/A,N/A,N/A,N/A,N/A,N/A,N/A,N/A,N/A,N/A,N/A,N/A,N/A,N/A,N/A,N/A,N/A,N/A,N/A,N/A,N/A,N/A,N/A,N/A,N/A,N/A,N/A,N/A,N/A,N/A,N/A,N/A,N/A,N/A,N/A,N/A,N/A,N/A,N/A,N/A
Award Amount,Amounts vary,Full tuition,N/A,Funding for private lessons,N/A,N/A,N/A,N/A,$3000 per year,$7500 per year (plus additional funding for educational enrichment),N/A,N/A,N/A,N/A,N/A,N/A,$10000/year,N/A,N/A,N/A,$7500 per academic year (minimum),N/A,N/A,Full tuition,N/A,N/A,N/A,N/A,N/A,N/A,N/A,N/A,N/A,N/A,N/A,N/A,N/A,N/A,N/A,N/A,$2500-$5000 per year,Up to $7500 per year,N/A,"$400 for winds, $500 for drumline/colorguard, $250 for pep band",N/A,€1000 or €2000/year,"€1650, €2500, or €5000/year",€1000 per year,€2000 per year,€4000 per year,€1000 (Year 1 only),€2000 (Year 1 only),€3000 (Year 1 only),€24000 over 2 years,$500-$1500,$20000 to full tuition,$2000-$20000 per year,N/A,$300,$450,$200,$1000,$300,$200 to full tuition,Full tuition,$20000,$20000,$10000,Varies,Varies,Varies,Varies,N/A,Varies,$500-$2000,Full or partial tuition remission,$600-$1000 per semester,$1000,$500,$1000,$500,$1000,$300-$4000,N/A,N/A,N/A,N/A,N/A,N/A,N/A,N/A,N/A,N/A,N/A,N/A,N/A,N/A,N/A,N/A,N/A,N/A,N/A,N/A,N/A,N/A,N/A,N/A,$500-$1000,$1000-$2000,Up to $1250,Up to $1000,$2000,$1200,$1200,N/A,N/A,$1000 to full tuition,N/A,N/A,N/A,Up to full tuition,Up to full tuition,Tuition discounts,"Up to $4000/year for majors, $800/year for minors",N/A,N/A,N/A,N/A,N/A,N/A,N/A,N/A
Description,Merit-based scholarships. Automatically considered for Berklee scholarships.,Presidential scholarships that are competitive and limited.,Scholarships granted by admission. No financial amounts specified.,Fellowship providing funding for private lessons. Instrument groups change each year.,Scholarship awarded to a music major (preferably a pianist) who is from Massachusetts.,Scholarship for junior or senior with a major in music preferably with concentration in music education.,Benefits music majors with their performance studies fees for private lessons as required by the Music Department.,Pep band scholarships based on ensemble needs and financial needs of student.,Academic merit scholarship for first-year students.,Academic merit scholarship for first-year students.,Prestigious scholarship for National Merit Finalists.,Scholarships awarded to undergraduate applicants who demonstrate superior musical ability.,Athletic band scholarships.,General music scholarship for majors minors and non-majors.,Ensemble scholarships awarded based on needs of ensembles.,Biannual music competition for vocal and instrumental students. Multiple scholarships presented.,Teaching assistant positions at Longy School of Music.,Merit-based scholarships at Longy School of Music.,Merit and need-based scholarship for full-time NEC students.,Merit and need-based scholarship for full-time NEC students.,Funding for students who have performed on From the Top program and have been admitted to NEC.,NEC Presidential Scholarship.,NEC Presidential Scholarship for classical music students.,NEC Presidential Scholarship providing full tuition support.,NEC Presidential Scholarship for jazz students.,NEC Presidential Scholarship.,NEC Presidential Scholarship.,NEC Presidential Scholarship.,NEC Presidential Scholarship for singers.,NEC Presidential Scholarship.,NEC Presidential Scholarship.,NEC Presidential Scholarship for singers.,NEC Presidential Scholarship for viola students.,NEC Presidential Scholarship for singers.,NEC Presidential Scholarship for violin students.,NEC Presidential Scholarship for opera program students.,NEC Presidential Scholarship for flute performance students.,NEC Dean's Scholarship for string students.,Northeastern University scholarship for students of outstanding merit pursuing a major in Music Industry.,Provides scholarships for students to improve choral skills hire guest performers and provide workshops.,Scholarships for instrumental orchestral and choral musicians in support of large ensembles.,Offered regardless of major to support music participation.,Performance-based scholarships for all wind brass percussion woodwind string keyboard instruments and voice.,Additional assistance for participation in marching band and pep band regardless of major.,No information about music scholarships available.,Administrative assistance scholarship paid separately from tuition for stewarding music admin library admissions work outreach etc.,Teaching assistant/accompanist scholarship based on hours worked.,Tuition fee scholarship based on audition ranking.,Tuition fee scholarship based on audition ranking.,Tuition fee scholarship based on audition ranking.,International first-time entrance scholarship.,International first-time entrance scholarship.,International first-time entrance scholarship.,Supports two winners to complete the 2-year Master in Music Performance. One vocal studies and one instrumental.,Various music scholarships available through filtered database search.,Scholarships based on application materials audition and financial information.,Scholarship for students pursuing degree within Shenandoah Conservatory.,No information provided for music scholarships.,Suffolk County Community College scholarship.,Suffolk County Community College scholarship.,Suffolk County Community College scholarship.,Suffolk County Community College scholarship.,Suffolk County Community College scholarship for voice students.,Talent-based scholarships. 30% of students receive.,Talent-based scholarship for entering students at Syracuse University.,Talent-based scholarship for entering students at Syracuse University.,Talent-based scholarship for entering students at Syracuse University.,Talent-based scholarship for entering students at Syracuse University.,Presented to outstanding high school seniors and transfer students committed to career in music theatre or dance.,Presented to outstanding high school seniors and transfer students planning to minor in music theatre or dance.,Presented annually to Taylor upperclassmen who are majors.,Presented to limited number of students interested in instrumental ensemble.,Scholarship for Bachelor of Fine Arts in Musical Theatre program.,Performance-based scholarships to any student based upon audition.,Scholarships for students of any major or school who join a band.,Music assistantships for full-time graduate students.,Performance grants for graduate students.,Ulster County Community College scholarship for music majors.,Ulster County Community College scholarship for music theater or fine arts students.,Ulster County Community College scholarship.,Ulster County Community College scholarship for wind band participants enrolled in AAS Music.,Ulster County Community College scholarship.,Music and dance scholarships made possible by alumni and friends support and Dean's Office.,Scholarships for members of the Minuteman Marching Band.,Scholarships for entering students majoring in Music with preference for first-year students.,Support for students' outstanding accomplishments in vocal or composition performance.,Supports students with demonstrated financial need and community service record.,Support for undergraduate or graduate students in music program.,Scholarship for music major whose primary applied area is trumpet.,Support for public high school student in four counties of Western Massachusetts intending to pursue degree in Music Education.,Award given to music majors who are graduating seniors.,Support for undergraduate percussionists in Minuteman Marching Band.,Support for highly qualified undergraduate students majoring in dance.,Support for undergraduate or graduate students in saxophone and horn studios.,Support for graduate or undergraduate students in Department of Music.,Annual award for student with extraordinary musical talent in piano performance.,Support for incoming first-year music major specializing as wind instrumentalist.,Support for outstanding graduate or undergraduate artist-violinist.,Supports music majors whose major performing instrument is voice for two years.,Presser Undergraduate Scholar Award presented to outstanding student majoring in music at end of junior year.,Support to recruit and retain Marching Band students.,Awarded on basis of merit to incoming first-year or transfer student as recruiting incentive.,For undergraduates pursuing second major in Department of Music and Dance with primary major in non-arts field.,Scholarship to recruit and retain outstanding students for UMass Amherst Minuteman Band.,Scholarship for full-time student in the Music program who demonstrates talent.,Scholarships offered to about 30 students each year based on audition.,Scholarship for being ambassador for music ensembles.,University of Colorado Denver scholarship for all arts and media students.,University of Colorado Denver scholarship for visual arts music or film students.,For students who attended LYNX National Arts & Media Camps as high school students.,A Cappella scholarship for students in Lark or 9th Street Singers groups.,Scholarship for BS in recording arts students.,Vocal music scholarship for students in A Capella group.,Scholarship for music majors enrolled in voice.,Talent-based scholarships for music majors.,Scholarship for students who participate in Fightin' Blue Hen Marching Band.,Comprehensive scholarship taking talent academic merit and financial need into consideration.,Undergraduate music major scholarships and partial out-of-state tuition waivers awarded based on audition.,Marching band scholarships. Audition required and automatically considered.,General music scholarships. Audition required and automatically considered.,Automatically awarded based on audition or interview. No separate application necessary.,Music scholarships awarded by audition.,Tuition discounts for participation in band ensembles.,Annually renewable music scholarships awarded by audition.,One-year non-renewable scholarships for current music students.,Ensemble scholarships awarded at discretion of ensemble directors.,One-year scholarships based on academic merit.,Westfield State University music scholarship.,Westfield State University scholarship for music majors.,4-year scholarship requiring audition and interview for music majors.,Westfield State University scholarship for music majors.,Westfield State University scholarship for students participating in musical theater.
