Institution,Scholarship Name,Deadline,Award Amount,Description,Requirements,Scholarship Link
University of Denver,Lamont School of Music Scholarships,N/A,$1000 to full tuition,Comprehensive scholarship taking talent academic merit and financial need into consideration.,Students applying to Lamont School of Music holistically considered. Ranges from $1000 to full tuition. Students awarded music scholarship not eligible for admission merit scholarship or institutional need-based grants. Notified within two weeks of admission decision.,N/A
University of Florida,Music Scholarships,N/A,N/A,Undergraduate music major scholarships and partial out-of-state tuition waivers awarded based on audition.,Music majors. Awarded based on talent determined at time of audition. No supplemental application required. Contact school via email for details.,N/A
University of Georgia,Marching Band Scholarships,N/A,N/A,Marching band scholarships. Audition required and automatically considered.,Audition. Automatically considered.,N/A
University of Georgia,General Music Scholarships,N/A,N/A,General music scholarships. Audition required and automatically considered.,Audition. Automatically considered.,N/A
University of Hartford,Performing Arts Scholarships,N/A,Up to full tuition,Automatically awarded based on audition or interview. No separate application necessary.,All applicants regardless of program automatically considered. Awarded by faculty based on student's audition (performance applicants) or interview (all other majors). Only full-time undergraduate students entering in fall semester considered. Awards not reviewed for increases in subsequent years. Renewable for length of program. Students adding second major or changing majors after beginning classes not eligible for scholarship beyond fourth year. Need-based grant funding available through FAFSA (filing deadline February 15).,N/A
University of Mary Hardin-Baylor,Music Scholarships,N/A,Up to full tuition,Music scholarships awarded by audition.,Incoming students can request audition. Awards up to full tuition available.,N/A
University of the Incarnate Word,Band Scholarship,N/A,Tuition discounts,Tuition discounts for participation in band ensembles.,Participation in band ensembles.,N/A
University of the Incarnate Word,Annually Renewable Music Scholarships,N/A,"Up to $4000/year for majors, $800/year for minors",Annually renewable music scholarships awarded by audition.,By audition. Requires participation in a major ensemble. Up to $4000/year for majors $800/year for minors.,N/A
University of the Incarnate Word,One-Year Music Scholarships,N/A,N/A,One-year non-renewable scholarships for current music students.,Current music students. Non-renewable.,N/A
University of the Incarnate Word,Ensemble Scholarships,N/A,N/A,Ensemble scholarships awarded at discretion of ensemble directors.,At discretion of ensemble directors.,N/A
University of the Incarnate Word,Endowed Scholarships,N/A,N/A,One-year scholarships based on academic merit.,One-year. Based on academic merit.,N/A
Westfield State University,Friends of Music Scholarship,N/A,N/A,Westfield State University music scholarship.,No info available.,N/A
Westfield State University,Dower Scholarship,N/A,N/A,Westfield State University scholarship for music majors.,Music majors.,N/A
Westfield State University,Rogers Music Merit Scholarship,N/A,N/A,4-year scholarship requiring audition and interview for music majors.,Music major. 4 years. Audition and interview required at Westfield State University.,N/A
Westfield State University,Manzer Music Scholarship,N/A,N/A,Westfield State University scholarship for music majors.,Music majors.,N/A
Westfield State University,Musical Theater Guild Scholarship,N/A,N/A,Westfield State University scholarship for students participating in musical theater.,Undergraduate who participates in musical theater.,N/A
